attack_id,name,aliases,description,created,modified,stix_id,url
G0119,Indrik Spider,Indrik Spider | Evil Corp | Manatee Tempest | DEV-0243 | UNC2165,"[Indrik Spider](https://attack.mitre.org/groups/G0119) is a Russia-based cybercriminal group that has been active since at least 2014. [Indrik Spider](https://attack.mitre.org/groups/G0119) initially started with the [Dridex](https://attack.mitre.org/software/S0384) banking Trojan, and then by 2017 they began running ransomware operations using [BitPaymer](https://attack.mitre.org/software/S0570), [WastedLocker](https://attack.mitre.org/software/S0612), and Hades ransomware. Following U.S. sanctions and an indictment in 2019, [Indrik Spider](https://attack.mitre.org/groups/G0119) changed their tactics and diversified their toolset.(Citation: Crowdstrike Indrik November 2018)(Citation: Crowdstrike EvilCorp March 2021)(Citation: Treasury EvilCorp Dec 2019)",2021-01-06T17:46:35.134Z,2024-10-28T19:11:56.485Z,intrusion-set--01e28736-2ffc-455b-9880-ed4d1407ae07,https://attack.mitre.org/groups/G0119
G1014,LuminousMoth,LuminousMoth,"[LuminousMoth](https://attack.mitre.org/groups/G1014) is a Chinese-speaking cyber espionage group that has been active since at least October 2020. [LuminousMoth](https://attack.mitre.org/groups/G1014) has targeted high-profile organizations, including government entities, in Myanmar, the Philippines, Thailand, and other parts of Southeast Asia. Some security researchers have concluded there is a connection between [LuminousMoth](https://attack.mitre.org/groups/G1014) and [Mustang Panda](https://attack.mitre.org/groups/G0129) based on similar targeting and TTPs, as well as network infrastructure overlaps.(Citation: Kaspersky LuminousMoth July 2021)(Citation: Bitdefender LuminousMoth July 2021)",2023-02-23T15:31:38.829Z,2025-04-16T20:37:32.806Z,intrusion-set--b7f627e2-0817-4cd5-8d50-e75f8aa85cc6,https://attack.mitre.org/groups/G1014
G1051,Medusa Group,Medusa Group,"[Medusa Group](https://attack.mitre.org/groups/G1051) has been active since at least 2021 and was initially operated as a closed ransomware group before evolving into a Ransomware-as-a-Service (RaaS) operation. Some reporting indicates that certain attacks may still be conducted directly by the ransomware’s core developers. Public sources have also referred to the group as “Spearwing” or “Medusa Actors.” (Citation: CISA Medusa Group Medusa Ransomware March 2025) (Citation: Broadcom Medusa Ransomware Medusa Group March 2025) [Medusa Group](https://attack.mitre.org/groups/G1051) employs living-off-the-land techniques, frequently leveraging publicly available tools and common remote management software to conduct operations. The group engages in double extortion tactics, exfiltrating data prior to encryption and threatening to publish stolen information if ransom demands are not met. (Citation: Security Scorecard Medusa Ransomware January 2024) For initial access, [Medusa Group](https://attack.mitre.org/groups/G1051) has exploited publicly known vulnerabilities, conducted phishing campaigns, and used credentials or access purchased from Initial Access Brokers (IABs). The group is opportunistic and has targeted a wide range of sectors globally. (Citation: Intel471 Medusa Ransomware May 2025)",2025-10-15T18:54:55.000Z,2025-10-24T04:01:48.210Z,intrusion-set--918da025-04bd-48af-b6c4-f3e4d1b915eb,https://attack.mitre.org/groups/G1051
G0102,Wizard Spider,Wizard Spider | UNC1878 | TEMP.MixMaster | Grim Spider | FIN12 | GOLD BLACKBURN | ITG23 | Periwinkle Tempest | DEV-0193,"[Wizard Spider](https://attack.mitre.org/groups/G0102) is a Russia-based financially motivated threat group originally known for the creation and deployment of [TrickBot](https://attack.mitre.org/software/S0266) since at least 2016. [Wizard Spider](https://attack.mitre.org/groups/G0102) possesses a diverse arsenal of tools and has conducted ransomware campaigns against a variety of organizations, ranging from major corporations to hospitals.(Citation: CrowdStrike Ryuk January 2019)(Citation: DHS/CISA Ransomware Targeting Healthcare October 2020)(Citation: CrowdStrike Wizard Spider October 2020)",2020-05-12T18:15:29.396Z,2025-03-12T20:33:21.597Z,intrusion-set--dd2d9ca6-505b-4860-a604-233685b802c7,https://attack.mitre.org/groups/G0102
G0066,Elderwood,Elderwood | Elderwood Gang | Beijing Group | Sneaky Panda,"[Elderwood](https://attack.mitre.org/groups/G0066) is a suspected Chinese cyber espionage group that was reportedly responsible for the 2009 Google intrusion known as Operation Aurora. (Citation: Security Affairs Elderwood Sept 2012) The group has targeted defense organizations, supply chain manufacturers, human rights and nongovernmental organizations (NGOs), and IT service providers. (Citation: Symantec Elderwood Sept 2012) (Citation: CSM Elderwood Sept 2012)",2018-04-18T17:59:24.739Z,2024-11-17T19:55:07.587Z,intrusion-set--03506554-5f37-4f8f-9ce4-0e9f01a1b484,https://attack.mitre.org/groups/G0066
G0101,Frankenstein,Frankenstein,[Frankenstein](https://attack.mitre.org/groups/G0101) is a campaign carried out between January and April 2019 by unknown threat actors. The campaign name comes from the actors' ability to piece together several unrelated components.(Citation: Talos Frankenstein June 2019),2020-05-11T15:21:09.438Z,2025-04-18T17:59:26.537Z,intrusion-set--6b1b551c-d770-4f95-8cfc-3cd253c4c04e,https://attack.mitre.org/groups/G0101
G0046,FIN7,FIN7 | GOLD NIAGARA | ITG14 | Carbon Spider | ELBRUS | Sangria Tempest,"[FIN7](https://attack.mitre.org/groups/G0046) is a financially-motivated threat group that has been active since 2013. [FIN7](https://attack.mitre.org/groups/G0046) has targeted the retail, restaurant, hospitality, software, consulting, financial services, medical equipment, cloud services, media, food and beverage, transportation, pharmaceutical, and utilities industries in the United States. A portion of [FIN7](https://attack.mitre.org/groups/G0046) was operated out of a front company called Combi Security and often used point-of-sale malware for targeting efforts. Since 2020, [FIN7](https://attack.mitre.org/groups/G0046) shifted operations to big game hunting (BGH), including use of [REvil](https://attack.mitre.org/software/S0496) ransomware and their own Ransomware-as-a-Service (RaaS), Darkside. FIN7 may be linked to the [Carbanak](https://attack.mitre.org/groups/G0008) Group, but multiple threat groups have been observed using [Carbanak](https://attack.mitre.org/software/S0030), leading these groups to be tracked separately.(Citation: FireEye FIN7 March 2017)(Citation: FireEye FIN7 April 2017)(Citation: FireEye CARBANAK June 2017)(Citation: FireEye FIN7 Aug 2018)(Citation: CrowdStrike Carbon Spider August 2021)(Citation: Mandiant FIN7 Apr 2022)(Citation: BiZone Lizar May 2021)",2017-05-31T21:32:09.460Z,2025-10-24T03:18:58.136Z,intrusion-set--3753cc21-2dae-4dfb-8481-d004e74502cc,https://attack.mitre.org/groups/G0046
G1048,UNC3886,UNC3886,"[UNC3886](https://attack.mitre.org/groups/G1048) is a China-nexus cyberespionage group that has been active since at least 2022, targeting defense, technology, and telecommunication organizations located in the United States and the Asia-Pacific-Japan (APJ) regions. [UNC3886](https://attack.mitre.org/groups/G1048) has displayed a deep understanding of edge devices and virtualization technologies through the exploitation of zero-day vulnerabilities and the use of novel malware families and utilities.(Citation: Mandiant Fortinet Zero Day)(Citation: Google Cloud Threat Intelligence VMWare ESXi Zero-Day 2023)",2025-05-29T20:48:42.051Z,2025-10-24T03:55:02.289Z,intrusion-set--461b8e25-8f4a-4ea2-a4a8-e39df7ce6630,https://attack.mitre.org/groups/G1048
G1047,Velvet Ant,Velvet Ant,"[Velvet Ant](https://attack.mitre.org/groups/G1047) is a threat actor operating since at least 2021. [Velvet Ant](https://attack.mitre.org/groups/G1047) is associated with complex persistence mechanisms, the targeting of network devices and appliances during operations, and the use of zero day exploits.(Citation: Sygnia VelvetAnt 2024A)(Citation: Sygnia VelvetAnt 2024B)",2025-03-14T19:21:17.470Z,2025-04-04T17:24:17.983Z,intrusion-set--e1fc262c-dad2-4b82-abda-5f08dd134971,https://attack.mitre.org/groups/G1047
G0090,WIRTE,WIRTE,"[WIRTE](https://attack.mitre.org/groups/G0090) is a threat group that has been active since at least August 2018. [WIRTE](https://attack.mitre.org/groups/G0090) has targeted government, diplomatic, financial, military, legal, and technology organizations in the Middle East and Europe.(Citation: Lab52 WIRTE Apr 2019)(Citation: Kaspersky WIRTE November 2021)",2019-05-24T17:02:44.226Z,2025-04-16T20:37:32.959Z,intrusion-set--f8cb7b36-62ef-4488-8a6d-a7033e3271c1,https://attack.mitre.org/groups/G0090
G0035,Dragonfly,Dragonfly | TEMP.Isotope | DYMALLOY | Berserk Bear | TG-4192 | Crouching Yeti | IRON LIBERTY | Energetic Bear | Ghost Blizzard | BROMINE,"[Dragonfly](https://attack.mitre.org/groups/G0035) is a cyber espionage group that has been attributed to Russia's Federal Security Service (FSB) Center 16.(Citation: DOJ Russia Targeting Critical Infrastructure March 2022)(Citation: UK GOV FSB Factsheet April 2022) Active since at least 2010, [Dragonfly](https://attack.mitre.org/groups/G0035) has targeted defense and aviation companies, government entities, companies related to industrial control systems, and critical infrastructure sectors worldwide through supply chain, spearphishing, and drive-by compromise attacks.(Citation: Symantec Dragonfly)(Citation: Secureworks IRON LIBERTY July 2019)(Citation: Symantec Dragonfly Sept 2017)(Citation: Fortune Dragonfly 2.0 Sept 2017)(Citation: Gigamon Berserk Bear October 2021)(Citation: CISA AA20-296A Berserk Bear December 2020)(Citation: Symantec Dragonfly 2.0 October 2017)",2017-05-31T21:32:05.217Z,2024-01-08T20:40:31.822Z,intrusion-set--1c63d4ec-0a75-4daa-b1df-0d11af3d3cc1,https://attack.mitre.org/groups/G0035
G0049,OilRig,OilRig | COBALT GYPSY | IRN2 | APT34 | Helix Kitten | Evasive Serpens | Hazel Sandstorm | EUROPIUM | ITG13 | Earth Simnavaz | Crambus | TA452,"[OilRig](https://attack.mitre.org/groups/G0049) is a suspected Iranian threat group that has targeted Middle Eastern and international victims since at least 2014. The group has targeted a variety of sectors, including financial, government, energy, chemical, and telecommunications. It appears the group carries out supply chain attacks, leveraging the trust relationship between organizations to attack their primary targets. The group works on behalf of the Iranian government based on infrastructure details that contain references to Iran, use of Iranian infrastructure, and targeting that aligns with nation-state interests.(Citation: FireEye APT34 Dec 2017)(Citation: Palo Alto OilRig April 2017)(Citation: ClearSky OilRig Jan 2017)(Citation: Palo Alto OilRig May 2016)(Citation: Palo Alto OilRig Oct 2016)(Citation: Unit42 OilRig Playbook 2023)(Citation: Unit 42 QUADAGENT July 2018)",2017-12-14T16:46:06.044Z,2025-01-16T18:55:49.463Z,intrusion-set--4ca1929c-7d64-4aab-b849-badbfc0c760d,https://attack.mitre.org/groups/G0049
G0020,Equation,Equation,[Equation](https://attack.mitre.org/groups/G0020) is a sophisticated threat group that employs multiple remote access tools. The group is known to use zero-day exploits and has developed the capability to overwrite the firmware of hard disk drives. (Citation: Kaspersky Equation QA),2017-05-31T21:31:54.697Z,2025-04-25T14:48:45.400Z,intrusion-set--96e239be-ad99-49eb-b127-3007b8c1bec9,https://attack.mitre.org/groups/G0020
G0117,Fox Kitten,Fox Kitten | UNC757 | Parisite | Pioneer Kitten | RUBIDIUM | Lemon Sandstorm,"[Fox Kitten](https://attack.mitre.org/groups/G0117) is threat actor with a suspected nexus to the Iranian government that has been active since at least 2017 against entities in the Middle East, North Africa, Europe, Australia, and North America. [Fox Kitten](https://attack.mitre.org/groups/G0117) has targeted multiple industrial verticals including oil and gas, technology, government, defense, healthcare, manufacturing, and engineering.(Citation: ClearkSky Fox Kitten February 2020)(Citation: CrowdStrike PIONEER KITTEN August 2020)(Citation: Dragos PARISITE )(Citation: ClearSky Pay2Kitten December 2020)",2020-12-21T21:49:47.307Z,2024-01-08T22:00:34.410Z,intrusion-set--c21dd6f1-1364-4a70-a1f7-783080ec34ee,https://attack.mitre.org/groups/G0117
G0032,Lazarus Group,Lazarus Group | Labyrinth Chollima | HIDDEN COBRA | Guardians of Peace | ZINC | NICKEL ACADEMY | Diamond Sleet,"[Lazarus Group](https://attack.mitre.org/groups/G0032) is a North Korean state-sponsored cyber threat group attributed to the Reconnaissance General Bureau (RGB). (Citation: US-CERT HIDDEN COBRA June 2017) (Citation: Treasury North Korean Cyber Groups September 2019) [Lazarus Group](https://attack.mitre.org/groups/G0032) has been active since at least 2009 and is reportedly responsible for the November 2014 destructive wiper attack on Sony Pictures Entertainment, identified by Novetta as part of Operation Blockbuster. Malware used by [Lazarus Group](https://attack.mitre.org/groups/G0032) correlates to other reported campaigns, including Operation Flame, Operation 1Mission, Operation Troy, DarkSeoul, and Ten Days of Rain.(Citation: Novetta Blockbuster) North Korea’s cyber operations have shown a consistent pattern of adaptation, forming and reorganizing units as national priorities shift. These units frequently share personnel, infrastructure, malware, and tradecraft, making it difficult to attribute specific operations with high confidence. Public reporting often uses “Lazarus Group” as an umbrella term for multiple North Korean cyber operators conducting espionage, destructive attacks, and financially motivated campaigns.(Citation: Mandiant DPRK Laz Org Breakdown 2022)(Citation: Mandiant DPRK Groups 2023)(Citation: JPCert Blog Laz Subgroups 2025)",2017-05-31T21:32:03.807Z,2025-10-24T01:29:21.748Z,intrusion-set--c93fccb1-e8e8-42cf-ae33-2ad1d183913a,https://attack.mitre.org/groups/G0032
G0143,Aquatic Panda,Aquatic Panda,"[Aquatic Panda](https://attack.mitre.org/groups/G0143) is a suspected China-based threat group with a dual mission of intelligence collection and industrial espionage. Active since at least May 2020, [Aquatic Panda](https://attack.mitre.org/groups/G0143) has primarily targeted entities in the telecommunications, technology, and government sectors.(Citation: CrowdStrike AQUATIC PANDA December 2021)",2022-01-18T14:49:29.505Z,2024-10-10T14:31:59.099Z,intrusion-set--64b52e7d-b2c4-4a02-9372-08a463f5dc11,https://attack.mitre.org/groups/G0143
G1034,Daggerfly,Daggerfly | Evasive Panda | BRONZE HIGHLAND,"[Daggerfly](https://attack.mitre.org/groups/G1034) is a People's Republic of China-linked APT entity active since at least 2012. [Daggerfly](https://attack.mitre.org/groups/G1034) has targeted individuals, government and NGO entities, and telecommunication companies in Asia and Africa. [Daggerfly](https://attack.mitre.org/groups/G1034) is associated with exclusive use of [MgBot](https://attack.mitre.org/software/S1146) malware and is noted for several potential supply chain infection campaigns.(Citation: Symantec Daggerfly 2023)(Citation: ESET EvasivePanda 2023)(Citation: Symantec Daggerfly 2024)(Citation: ESET EvasivePanda 2024)",2024-07-25T17:13:06.098Z,2024-10-31T18:33:10.434Z,intrusion-set--f3be6240-f68e-47e1-90d2-ad8f3b3bb8a6,https://attack.mitre.org/groups/G1034
G0139,TeamTNT,TeamTNT,[TeamTNT](https://attack.mitre.org/groups/G0139) is a threat group that has primarily targeted cloud and containerized environments. The group as been active since at least October 2019 and has mainly focused its efforts on leveraging cloud and container resources to deploy cryptocurrency miners in victim environments.(Citation: Palo Alto Black-T October 2020)(Citation: Lacework TeamTNT May 2021)(Citation: Intezer TeamTNT September 2020)(Citation: Cado Security TeamTNT Worm August 2020)(Citation: Unit 42 Hildegard Malware)(Citation: Trend Micro TeamTNT)(Citation: ATT TeamTNT Chimaera September 2020)(Citation: Aqua TeamTNT August 2020)(Citation: Intezer TeamTNT Explosion September 2021),2021-10-01T01:57:31.229Z,2025-10-22T03:04:28.916Z,intrusion-set--35d1b3be-49d4-42f1-aaa6-ef159c880bca,https://attack.mitre.org/groups/G0139
G0092,TA505,TA505 | Hive0065 | Spandex Tempest | CHIMBORAZO,"[TA505](https://attack.mitre.org/groups/G0092) is a cyber criminal group that has been active since at least 2014. [TA505](https://attack.mitre.org/groups/G0092) is known for frequently changing malware, driving global trends in criminal malware distribution, and ransomware campaigns involving [Clop](https://attack.mitre.org/software/S0611).(Citation: Proofpoint TA505 Sep 2017)(Citation: Proofpoint TA505 June 2018)(Citation: Proofpoint TA505 Jan 2019)(Citation: NCC Group TA505)(Citation: Korean FSI TA505 2020)",2019-05-28T15:54:17.213Z,2024-04-10T22:37:02.592Z,intrusion-set--7eda3dd8-b09b-4705-8090-c2ad9fb8c14d,https://attack.mitre.org/groups/G0092
G0100,Inception,Inception | Inception Framework | Cloud Atlas,"[Inception](https://attack.mitre.org/groups/G0100) is a cyber espionage group active since at least 2014. The group has targeted multiple industries and governmental entities primarily in Russia, but has also been active in the United States and throughout Europe, Asia, Africa, and the Middle East.(Citation: Unit 42 Inception November 2018)(Citation: Symantec Inception Framework March 2018)(Citation: Kaspersky Cloud Atlas December 2014)",2020-05-08T17:01:04.058Z,2024-04-11T02:15:23.096Z,intrusion-set--ead23196-d7b6-4ce6-a124-4ab4b67d81bd,https://attack.mitre.org/groups/G0100
G0018,admin@338,admin@338,"[admin@338](https://attack.mitre.org/groups/G0018) is a China-based cyber threat group. It has previously used newsworthy events as lures to deliver malware and has primarily targeted organizations involved in financial, economic, and trade policy, typically using publicly available RATs such as [PoisonIvy](https://attack.mitre.org/software/S0012), as well as some non-public backdoors. (Citation: FireEye admin@338)",2017-05-31T21:31:53.579Z,2025-04-25T14:48:47.886Z,intrusion-set--16ade1aa-0ea1-4bb7-88cc-9079df2ae756,https://attack.mitre.org/groups/G0018
G0098,BlackTech,BlackTech | Palmerworm,"[BlackTech](https://attack.mitre.org/groups/G0098) is a suspected Chinese cyber espionage group that has primarily targeted organizations in East Asia--particularly Taiwan, Japan, and Hong Kong--and the US since at least 2013. [BlackTech](https://attack.mitre.org/groups/G0098) has used a combination of custom malware, dual-use tools, and living off the land tactics to compromise media, construction, engineering, electronics, and financial company networks.(Citation: TrendMicro BlackTech June 2017)(Citation: Symantec Palmerworm Sep 2020)(Citation: Reuters Taiwan BlackTech August 2020)",2020-05-05T18:36:45.970Z,2025-04-25T19:03:07.787Z,intrusion-set--6fe8a2a1-a1b0-4af8-953d-4babd329f8f8,https://attack.mitre.org/groups/G0098
G1044,APT42,APT42,"[APT42](https://attack.mitre.org/groups/G1044) is an Iranian-sponsored threat group that conducts cyber espionage and surveillance.(Citation: Mandiant APT42-charms) The group primarily focuses on targets in the Middle East region, but has targeted a variety of industries and countries since at least 2015.(Citation: Mandiant APT42-charms) [APT42](https://attack.mitre.org/groups/G1044) starts cyber operations through spearphishing emails and/or the PINEFLOWER Android malware, then monitors and collects information from the compromised systems and devices.(Citation: Mandiant APT42-charms) Finally, [APT42](https://attack.mitre.org/groups/G1044) exfiltrates data using native features and open-source tools.(Citation: Mandiant APT42-untangling) [APT42](https://attack.mitre.org/groups/G1044) activities have been linked to [Magic Hound](https://attack.mitre.org/groups/G0059) by other commercial vendors. While there are behavior and software overlaps between [Magic Hound](https://attack.mitre.org/groups/G0059) and [APT42](https://attack.mitre.org/groups/G1044), they appear to be distinct entities and are tracked as separate entities by their originating vendor.",2025-01-08T17:08:26.378Z,2025-03-08T18:42:45.320Z,intrusion-set--c0291346-defe-48d7-9542-9e074ba1bdfb,https://attack.mitre.org/groups/G1044
G1026,Malteiro,Malteiro,[Malteiro](https://attack.mitre.org/groups/G1026) is a financially motivated criminal group that is likely based in Brazil and has been active since at least November 2019. The group operates and distributes the [Mispadu](https://attack.mitre.org/software/S1122) banking trojan via a Malware-as-a-Service (MaaS) business model. [Malteiro](https://attack.mitre.org/groups/G1026) mainly targets victims throughout Latin America (particularly Mexico) and Europe (particularly Spain and Portugal).(Citation: SCILabs Malteiro 2021),2024-03-13T20:23:54.698Z,2024-03-29T14:10:35.711Z,intrusion-set--bf668120-e9a6-4017-a014-bfc0f5232656,https://attack.mitre.org/groups/G1026
G1006,Earth Lusca,Earth Lusca | TAG-22 | Charcoal Typhoon | CHROMIUM | ControlX,"[Earth Lusca](https://attack.mitre.org/groups/G1006) is a suspected China-based cyber espionage group that has been active since at least April 2019. [Earth Lusca](https://attack.mitre.org/groups/G1006) has targeted organizations in Australia, China, Hong Kong, Mongolia, Nepal, the Philippines, Taiwan, Thailand, Vietnam, the United Arab Emirates, Nigeria, Germany, France, and the United States. Targets included government institutions, news media outlets, gambling companies, educational institutions, COVID-19 research organizations, telecommunications companies, religious movements banned in China, and cryptocurrency trading platforms; security researchers assess some [Earth Lusca](https://attack.mitre.org/groups/G1006) operations may be financially motivated.(Citation: TrendMicro EarthLusca 2022) [Earth Lusca](https://attack.mitre.org/groups/G1006) has used malware commonly used by other Chinese threat groups, including [APT41](https://attack.mitre.org/groups/G0096) and the [Winnti Group](https://attack.mitre.org/groups/G0044) cluster, however security researchers assess [Earth Lusca](https://attack.mitre.org/groups/G1006)'s techniques and infrastructure are separate.(Citation: TrendMicro EarthLusca 2022)",2022-07-01T20:12:30.184Z,2025-06-06T14:55:18.144Z,intrusion-set--cc613a49-9bfa-4e22-98d1-15ffbb03f034,https://attack.mitre.org/groups/G1006
G1040,Play,Play,"[Play](https://attack.mitre.org/groups/G1040) is a ransomware group that has been active since at least 2022 deploying [Playcrypt](https://attack.mitre.org/software/S1162) ransomware against the business, government, critical infrastructure, healthcare, and media sectors in North America, South America, and Europe. [Play](https://attack.mitre.org/groups/G1040) actors employ a double-extortion model, encrypting systems after exfiltrating data, and are presumed by security researchers to operate as a closed group.(Citation: CISA Play Ransomware Advisory December 2023)(Citation: Trend Micro Ransomware Spotlight Play July 2023)",2024-09-24T19:48:18.278Z,2024-10-02T05:37:34.149Z,intrusion-set--ecbf507f-6786-4121-a4cc-0fd6a8d3a29d,https://attack.mitre.org/groups/G1040
G0034,Sandworm Team,Sandworm Team | ELECTRUM | Telebots | IRON VIKING | BlackEnergy (Group) | Quedagh | Voodoo Bear | IRIDIUM | Seashell Blizzard | FROZENBARENTS | APT44,"[Sandworm Team](https://attack.mitre.org/groups/G0034) is a destructive threat group that has been attributed to Russia's General Staff Main Intelligence Directorate (GRU) Main Center for Special Technologies (GTsST) military unit 74455.(Citation: US District Court Indictment GRU Unit 74455 October 2020)(Citation: UK NCSC Olympic Attacks October 2020) This group has been active since at least 2009.(Citation: iSIGHT Sandworm 2014)(Citation: CrowdStrike VOODOO BEAR)(Citation: USDOJ Sandworm Feb 2020)(Citation: NCSC Sandworm Feb 2020) In October 2020, the US indicted six GRU Unit 74455 officers associated with [Sandworm Team](https://attack.mitre.org/groups/G0034) for the following cyber operations: the 2015 and 2016 attacks against Ukrainian electrical companies and government organizations, the 2017 worldwide [NotPetya](https://attack.mitre.org/software/S0368) attack, targeting of the 2017 French presidential campaign, the 2018 [Olympic Destroyer](https://attack.mitre.org/software/S0365) attack against the Winter Olympic Games, the 2018 operation against the Organisation for the Prohibition of Chemical Weapons, and attacks against the country of Georgia in 2018 and 2019.(Citation: US District Court Indictment GRU Unit 74455 October 2020)(Citation: UK NCSC Olympic Attacks October 2020) Some of these were conducted with the assistance of GRU Unit 26165, which is also referred to as [APT28](https://attack.mitre.org/groups/G0007).(Citation: US District Court Indictment GRU Oct 2018)",2017-05-31T21:32:04.588Z,2024-12-04T21:17:08.593Z,intrusion-set--381fcf73-60f6-4ab2-9991-6af3cbc35192,https://attack.mitre.org/groups/G0034
G1037,TA577,TA577,"[TA577](https://attack.mitre.org/groups/G1037) is an initial access broker (IAB) that has distributed [QakBot](https://attack.mitre.org/software/S0650) and [Pikabot](https://attack.mitre.org/software/S1145), and was among the first observed groups distributing [Latrodectus](https://attack.mitre.org/software/S1160) in 2023.(Citation: Latrodectus APR 2024)",2024-09-17T16:05:53.084Z,2024-09-17T16:07:34.686Z,intrusion-set--13ef3485-70d2-4567-b934-0e83c1eafcf1,https://attack.mitre.org/groups/G1037
