attack_id,name,aliases,description,created,modified,stix_id,url
G0010,Turla,Turla | IRON HUNTER | Group 88 | Waterbug | WhiteBear | Snake | Krypton | Venomous Bear | Secret Blizzard | BELUGASTURGEON,"[Turla](https://attack.mitre.org/groups/G0010) is a cyber espionage threat group that has been attributed to Russia's Federal Security Service (FSB). They have compromised victims in over 50 countries since at least 2004, spanning a range of industries including government, embassies, military, education, research and pharmaceutical companies. [Turla](https://attack.mitre.org/groups/G0010) is known for conducting watering hole and spearphishing campaigns, and leveraging in-house tools and malware, such as [Uroburos](https://attack.mitre.org/software/S0022).(Citation: Kaspersky Turla)(Citation: ESET Gazer Aug 2017)(Citation: CrowdStrike VENOMOUS BEAR)(Citation: ESET Turla Mosquito Jan 2018)(Citation: Joint Cybersecurity Advisory AA23-129A Snake Malware May 2023)",2017-05-31T21:31:49.816Z,2024-06-26T18:09:33.862Z,intrusion-set--7a19ecb1-3c65-4de3-a230-993516aed6a6,https://attack.mitre.org/groups/G0010
G0039,Suckfly,Suckfly,[Suckfly](https://attack.mitre.org/groups/G0039) is a China-based threat group that has been active since at least 2014. (Citation: Symantec Suckfly March 2016),2017-05-31T21:32:06.777Z,2025-04-16T20:37:33.565Z,intrusion-set--5cbe0d3b-6fb1-471f-b591-4b192915116d,https://attack.mitre.org/groups/G0039
G1003,Ember Bear,Ember Bear | UNC2589 | Bleeding Bear | DEV-0586 | Cadet Blizzard | Frozenvista | UAC-0056,"[Ember Bear](https://attack.mitre.org/groups/G1003) is a Russian state-sponsored cyber espionage group that has been active since at least 2020, linked to Russia's General Staff Main Intelligence Directorate (GRU) 161st Specialist Training Center (Unit 29155).(Citation: CISA GRU29155 2024) [Ember Bear](https://attack.mitre.org/groups/G1003) has primarily focused operations against Ukrainian government and telecommunication entities, but has also operated against critical infrastructure entities in Europe and the Americas.(Citation: Cadet Blizzard emerges as novel threat actor) [Ember Bear](https://attack.mitre.org/groups/G1003) conducted the [WhisperGate](https://attack.mitre.org/software/S0689) destructive wiper attacks against Ukraine in early 2022.(Citation: CrowdStrike Ember Bear Profile March 2022)(Citation: Mandiant UNC2589 March 2022)(Citation: CISA GRU29155 2024) There is some confusion as to whether [Ember Bear](https://attack.mitre.org/groups/G1003) overlaps with another Russian-linked entity referred to as [Saint Bear](https://attack.mitre.org/groups/G1031). At present available evidence strongly suggests these are distinct activities with different behavioral profiles.(Citation: Cadet Blizzard emerges as novel threat actor)(Citation: Palo Alto Unit 42 OutSteel SaintBot February 2022 )",2022-06-09T14:49:57.704Z,2025-04-25T19:03:38.177Z,intrusion-set--a7f57cc1-4540-4429-823f-f4e56b8473c9,https://attack.mitre.org/groups/G1003
G0037,FIN6,FIN6 | Magecart Group 6 | ITG08 | Skeleton Spider | TAAL | Camouflage Tempest,[FIN6](https://attack.mitre.org/groups/G0037) is a cyber crime group that has stolen payment card data and sold it for profit on underground marketplaces. This group has aggressively targeted and compromised point of sale (PoS) systems in the hospitality and retail sectors.(Citation: FireEye FIN6 April 2016)(Citation: FireEye FIN6 Apr 2019),2017-05-31T21:32:06.015Z,2024-11-17T14:59:25.749Z,intrusion-set--2a7914cf-dff3-428d-ab0f-1014d1c28aeb,https://attack.mitre.org/groups/G0037
G0091,Silence,Silence | Whisper Spider,"[Silence](https://attack.mitre.org/groups/G0091) is a financially motivated threat actor targeting financial institutions in different countries. The group was first seen in June 2016. Their main targets reside in Russia, Ukraine, Belarus, Azerbaijan, Poland and Kazakhstan. They compromised various banking systems, including the Russian Central Bank's Automated Workstation Client, ATMs, and card processing.(Citation: Cyber Forensicator Silence Jan 2019)(Citation: SecureList Silence Nov 2017)",2019-05-24T17:57:36.491Z,2024-11-17T18:19:52.955Z,intrusion-set--d13c8a7f-740b-4efa-a232-de7d6bb05321,https://attack.mitre.org/groups/G0091
G0040,Patchwork,Patchwork | Hangover Group | Dropping Elephant | Chinastrats | MONSOON | Operation Hangover,"[Patchwork](https://attack.mitre.org/groups/G0040) is a cyber espionage group that was first observed in December 2015. While the group has not been definitively attributed, circumstantial evidence suggests the group may be a pro-Indian or Indian entity. [Patchwork](https://attack.mitre.org/groups/G0040) has been seen targeting industries related to diplomatic and government agencies. Much of the code used by this group was copied and pasted from online forums. [Patchwork](https://attack.mitre.org/groups/G0040) was also seen operating spearphishing campaigns targeting U.S. think tank groups in March and April of 2018.(Citation: Cymmetria Patchwork) (Citation: Symantec Patchwork)(Citation: TrendMicro Patchwork Dec 2017)(Citation: Volexity Patchwork June 2018)",2017-05-31T21:32:07.145Z,2025-10-21T23:13:16.458Z,intrusion-set--17862c7d-9e60-48a0-b48e-da4dc4c3f6b0,https://attack.mitre.org/groups/G0040
G0007,APT28,APT28 | IRON TWILIGHT | SNAKEMACKEREL | Swallowtail | Group 74 | Sednit | Sofacy | Pawn Storm | Fancy Bear | STRONTIUM | Tsar Team | Threat Group-4127 | TG-4127 | Forest Blizzard | FROZENLAKE | GruesomeLarch,"[APT28](https://attack.mitre.org/groups/G0007) is a threat group that has been attributed to Russia's General Staff Main Intelligence Directorate (GRU) 85th Main Special Service Center (GTsSS) military unit 26165.(Citation: NSA/FBI Drovorub August 2020)(Citation: Cybersecurity Advisory GRU Brute Force Campaign July 2021) This group has been active since at least 2004.(Citation: DOJ GRU Indictment Jul 2018)(Citation: Ars Technica GRU indictment Jul 2018)(Citation: Crowdstrike DNC June 2016)(Citation: FireEye APT28)(Citation: SecureWorks TG-4127)(Citation: FireEye APT28 January 2017)(Citation: GRIZZLY STEPPE JAR)(Citation: Sofacy DealersChoice)(Citation: Palo Alto Sofacy 06-2018)(Citation: Symantec APT28 Oct 2018)(Citation: ESET Zebrocy May 2019) [APT28](https://attack.mitre.org/groups/G0007) reportedly compromised the Hillary Clinton campaign, the Democratic National Committee, and the Democratic Congressional Campaign Committee in 2016 in an attempt to interfere with the U.S. presidential election.(Citation: Crowdstrike DNC June 2016) In 2018, the US indicted five GRU Unit 26165 officers associated with [APT28](https://attack.mitre.org/groups/G0007) for cyber operations (including close-access operations) conducted between 2014 and 2018 against the World Anti-Doping Agency (WADA), the US Anti-Doping Agency, a US nuclear facility, the Organization for the Prohibition of Chemical Weapons (OPCW), the Spiez Swiss Chemicals Laboratory, and other organizations.(Citation: US District Court Indictment GRU Oct 2018) Some of these were conducted with the assistance of GRU Unit 74455, which is also referred to as [Sandworm Team](https://attack.mitre.org/groups/G0034).",2017-05-31T21:31:48.664Z,2025-03-10T20:15:06.958Z,intrusion-set--bef4c620-0787-42a8-a96d-b7eb6e85917c,https://attack.mitre.org/groups/G0007
G1007,Aoqin Dragon,Aoqin Dragon,"[Aoqin Dragon](https://attack.mitre.org/groups/G1007) is a suspected Chinese cyber espionage threat group that has been active since at least 2013. [Aoqin Dragon](https://attack.mitre.org/groups/G1007) has primarily targeted government, education, and telecommunication organizations in Australia, Cambodia, Hong Kong, Singapore, and Vietnam. Security researchers noted a potential association between [Aoqin Dragon](https://attack.mitre.org/groups/G1007) and UNC94, based on malware, infrastructure, and targets.(Citation: SentinelOne Aoqin Dragon June 2022)",2022-07-14T14:32:47.582Z,2025-04-16T20:37:33.761Z,intrusion-set--64d5f96a-f121-4d19-89f6-6709f5c49faa,https://attack.mitre.org/groups/G1007
G1021,Cinnamon Tempest,Cinnamon Tempest | DEV-0401 | Emperor Dragonfly | BRONZE STARLIGHT,"[Cinnamon Tempest](https://attack.mitre.org/groups/G1021) is a China-based threat group that has been active since at least 2021 deploying multiple strains of ransomware based on the leaked [Babuk](https://attack.mitre.org/software/S0638) source code. [Cinnamon Tempest](https://attack.mitre.org/groups/G1021) does not operate their ransomware on an affiliate model or purchase access but appears to act independently in all stages of the attack lifecycle. Based on victimology, the short lifespan of each ransomware variant, and use of malware attributed to government-sponsored threat groups, [Cinnamon Tempest](https://attack.mitre.org/groups/G1021) may be motivated by intellectual property theft or cyberespionage rather than financial gain.(Citation: Microsoft Ransomware as a Service)(Citation: Microsoft Threat Actor Naming July 2023)(Citation: Trend Micro Cheerscrypt May 2022)(Citation: SecureWorks BRONZE STARLIGHT Ransomware Operations June 2022)",2023-12-06T19:53:04.988Z,2024-04-04T23:27:22.311Z,intrusion-set--8b1e16f6-e7c8-4b7a-a5df-f81232c13e2f,https://attack.mitre.org/groups/G1021
G1001,HEXANE,HEXANE | Lyceum | Siamesekitten | Spirlin,"[HEXANE](https://attack.mitre.org/groups/G1001) is a cyber espionage threat group that has targeted oil & gas, telecommunications, aviation, and internet service provider organizations since at least 2017. Targeted companies have been located in the Middle East and Africa, including Israel, Saudi Arabia, Kuwait, Morocco, and Tunisia. [HEXANE](https://attack.mitre.org/groups/G1001)'s TTPs appear similar to [APT33](https://attack.mitre.org/groups/G0064) and [OilRig](https://attack.mitre.org/groups/G0049) but due to differences in victims and tools it is tracked as a separate entity.(Citation: Dragos Hexane)(Citation: Kaspersky Lyceum October 2021)(Citation: ClearSky Siamesekitten August 2021)(Citation: Accenture Lyceum Targets November 2021)",2018-10-17T00:14:20.652Z,2024-08-14T15:24:19.141Z,intrusion-set--f29b7c5e-2439-42ad-a86f-9f8984fafae3,https://attack.mitre.org/groups/G1001
G0012,Darkhotel,Darkhotel | DUBNIUM | Zigzag Hail,[Darkhotel](https://attack.mitre.org/groups/G0012) is a suspected South Korean threat group that has targeted victims primarily in East Asia since at least 2004. The group's name is based on cyber espionage operations conducted via hotel Internet networks against traveling executives and other select guests. [Darkhotel](https://attack.mitre.org/groups/G0012) has also conducted spearphishing campaigns and infected victims through peer-to-peer and file sharing networks.(Citation: Kaspersky Darkhotel)(Citation: Securelist Darkhotel Aug 2015)(Citation: Microsoft Digital Defense FY20 Sept 2020),2017-05-31T21:31:50.624Z,2024-01-08T20:27:56.707Z,intrusion-set--9e729a7e-0dd6-4097-95bf-db8d64911383,https://attack.mitre.org/groups/G0012
G0004,Ke3chang,Ke3chang | APT15 | Mirage | Vixen Panda | GREF | Playful Dragon | RoyalAPT | NICKEL | Nylon Typhoon,"[Ke3chang](https://attack.mitre.org/groups/G0004) is a threat group attributed to actors operating out of China. [Ke3chang](https://attack.mitre.org/groups/G0004) has targeted oil, government, diplomatic, military, and NGOs in Central and South America, the Caribbean, Europe, and North America since at least 2010.(Citation: Mandiant Operation Ke3chang November 2014)(Citation: NCC Group APT15 Alive and Strong)(Citation: APT15 Intezer June 2018)(Citation: Microsoft NICKEL December 2021)",2017-05-31T21:31:47.177Z,2025-04-04T17:08:55.617Z,intrusion-set--6713ab67-e25b-49cc-808d-2b36d4fbc35c,https://attack.mitre.org/groups/G0004
G0072,Honeybee,Honeybee,"[Honeybee](https://attack.mitre.org/groups/G0072) is a campaign led by an unknown actor that targets humanitarian aid organizations and has been active in Vietnam, Singapore, Argentina, Japan, Indonesia, and Canada. It has been an active operation since August of 2017 and as recently as February 2018. (Citation: McAfee Honeybee)",2018-10-17T00:14:20.652Z,2025-04-18T17:59:26.884Z,intrusion-set--ebb73863-fa44-4617-b4cb-b9ed3414eb87,https://attack.mitre.org/groups/G0072
G1017,Volt Typhoon,Volt Typhoon | BRONZE SILHOUETTE | Vanguard Panda | DEV-0391 | UNC3236 | Voltzite | Insidious Taurus,"[Volt Typhoon](https://attack.mitre.org/groups/G1017) is a People's Republic of China (PRC) state-sponsored actor that has been active since at least 2021 primarily targeting critical infrastructure organizations in the US and its territories including Guam. [Volt Typhoon](https://attack.mitre.org/groups/G1017)'s targeting and pattern of behavior have been assessed as pre-positioning to enable lateral movement to operational technology (OT) assets for potential destructive or disruptive attacks. [Volt Typhoon](https://attack.mitre.org/groups/G1017) has emphasized stealth in operations using web shells, living-off-the-land (LOTL) binaries, hands on keyboard activities, and stolen credentials.(Citation: CISA AA24-038A PRC Critical Infrastructure February 2024)(Citation: Microsoft Volt Typhoon May 2023)(Citation: Joint Cybersecurity Advisory Volt Typhoon June 2023)(Citation: Secureworks BRONZE SILHOUETTE May 2023)",2023-07-27T20:35:46.206Z,2025-04-30T13:27:45.018Z,intrusion-set--174279b4-399f-4ddb-966e-5efedd1dd5f2,https://attack.mitre.org/groups/G1017
G0077,Leafminer,Leafminer | Raspite,[Leafminer](https://attack.mitre.org/groups/G0077) is an Iranian threat group that has targeted government organizations and business entities in the Middle East since at least early 2017. (Citation: Symantec Leafminer July 2018),2018-10-17T00:14:20.652Z,2025-04-16T20:37:33.912Z,intrusion-set--32bca8ff-d900-4877-aa65-d70baa041b74,https://attack.mitre.org/groups/G0077
G0059,Magic Hound,Magic Hound | TA453 | COBALT ILLUSION | Charming Kitten | ITG18 | Phosphorus | Newscaster | APT35 | Mint Sandstorm,"[Magic Hound](https://attack.mitre.org/groups/G0059) is an Iranian-sponsored threat group that conducts long term, resource-intensive cyber espionage operations, likely on behalf of the Islamic Revolutionary Guard Corps. They have targeted European, U.S., and Middle Eastern government and military personnel, academics, journalists, and organizations such as the World Health Organization (WHO), via complex social engineering campaigns since at least 2014.(Citation: FireEye APT35 2018)(Citation: ClearSky Kittens Back 3 August 2020)(Citation: Certfa Charming Kitten January 2021)(Citation: Secureworks COBALT ILLUSION Threat Profile)(Citation: Proofpoint TA453 July2021)",2018-01-16T16:13:52.465Z,2024-11-17T16:17:26.385Z,intrusion-set--f9d6633a-55e6-4adc-9263-6ae080421a13,https://attack.mitre.org/groups/G0059
G0016,APT29,APT29 | IRON RITUAL | IRON HEMLOCK | NobleBaron | Dark Halo | NOBELIUM | UNC2452 | YTTRIUM | The Dukes | Cozy Bear | CozyDuke | SolarStorm | Blue Kitsune | UNC3524 | Midnight Blizzard,"[APT29](https://attack.mitre.org/groups/G0016) is threat group that has been attributed to Russia's Foreign Intelligence Service (SVR).(Citation: White House Imposing Costs RU Gov April 2021)(Citation: UK Gov Malign RIS Activity April 2021) They have operated since at least 2008, often targeting government networks in Europe and NATO member countries, research institutes, and think tanks. [APT29](https://attack.mitre.org/groups/G0016) reportedly compromised the Democratic National Committee starting in the summer of 2015.(Citation: F-Secure The Dukes)(Citation: GRIZZLY STEPPE JAR)(Citation: Crowdstrike DNC June 2016)(Citation: UK Gov UK Exposes Russia SolarWinds April 2021) In April 2021, the US and UK governments attributed the [SolarWinds Compromise](https://attack.mitre.org/campaigns/C0024) to the SVR; public statements included citations to [APT29](https://attack.mitre.org/groups/G0016), Cozy Bear, and The Dukes.(Citation: NSA Joint Advisory SVR SolarWinds April 2021)(Citation: UK NSCS Russia SolarWinds April 2021) Industry reporting also referred to the actors involved in this campaign as UNC2452, NOBELIUM, StellarParticle, Dark Halo, and SolarStorm.(Citation: FireEye SUNBURST Backdoor December 2020)(Citation: MSTIC NOBELIUM Mar 2021)(Citation: CrowdStrike SUNSPOT Implant January 2021)(Citation: Volexity SolarWinds)(Citation: Cybersecurity Advisory SVR TTP May 2021)(Citation: Unit 42 SolarStorm December 2020)",2017-05-31T21:31:52.748Z,2025-04-04T17:07:43.344Z,intrusion-set--899ce53f-13a0-479b-a0e4-67d46e241542,https://attack.mitre.org/groups/G0016
G1011,EXOTIC LILY,EXOTIC LILY,"[EXOTIC LILY](https://attack.mitre.org/groups/G1011) is a financially motivated group that has been closely linked with [Wizard Spider](https://attack.mitre.org/groups/G0102) and the deployment of ransomware including [Conti](https://attack.mitre.org/software/S0575) and [Diavol](https://attack.mitre.org/software/S0659). [EXOTIC LILY](https://attack.mitre.org/groups/G1011) may be acting as an initial access broker for other malicious actors, and has targeted a wide range of industries including IT, cybersecurity, and healthcare since at least September 2021.(Citation: Google EXOTIC LILY March 2022)",2022-08-18T15:25:59.689Z,2025-04-16T20:37:34.060Z,intrusion-set--129f2f77-1ab2-4c35-bd5e-21260cee92af,https://attack.mitre.org/groups/G1011
G0080,Cobalt Group,Cobalt Group | GOLD KINGSWOOD | Cobalt Gang | Cobalt Spider,"[Cobalt Group](https://attack.mitre.org/groups/G0080) is a financially motivated threat group that has primarily targeted financial institutions since at least 2016. The group has conducted intrusions to steal money via targeting ATM systems, card processing, payment systems and SWIFT systems. [Cobalt Group](https://attack.mitre.org/groups/G0080) has mainly targeted banks in Eastern Europe, Central Asia, and Southeast Asia. One of the alleged leaders was arrested in Spain in early 2018, but the group still appears to be active. The group has been known to target organizations in order to use their access to then compromise additional victims.(Citation: Talos Cobalt Group July 2018)(Citation: PTSecurity Cobalt Group Aug 2017)(Citation: PTSecurity Cobalt Dec 2016)(Citation: Group IB Cobalt Aug 2017)(Citation: Proofpoint Cobalt June 2017)(Citation: RiskIQ Cobalt Nov 2017)(Citation: RiskIQ Cobalt Jan 2018) Reporting indicates there may be links between [Cobalt Group](https://attack.mitre.org/groups/G0080) and both the malware [Carbanak](https://attack.mitre.org/software/S0030) and the group [Carbanak](https://attack.mitre.org/groups/G0008).(Citation: Europol Cobalt Mar 2018)",2018-10-17T00:14:20.652Z,2025-04-16T20:37:34.214Z,intrusion-set--dc6fe6ee-04c2-49be-ba3d-f38d2463c02a,https://attack.mitre.org/groups/G0080
G0138,Andariel,Andariel | Silent Chollima | PLUTONIUM | Onyx Sleet,"[Andariel](https://attack.mitre.org/groups/G0138) is a North Korean state-sponsored threat group that has been active since at least 2009. [Andariel](https://attack.mitre.org/groups/G0138) has primarily focused its operations--which have included destructive attacks--against South Korean government agencies, military organizations, and a variety of domestic companies; they have also conducted cyber financial operations against ATMs, banks, and cryptocurrency exchanges. [Andariel](https://attack.mitre.org/groups/G0138)'s notable activity includes Operation Black Mine, Operation GoldenAxe, and Campaign Rifle.(Citation: FSI Andariel Campaign Rifle July 2017)(Citation: IssueMakersLab Andariel GoldenAxe May 2017)(Citation: AhnLab Andariel Subgroup of Lazarus June 2018)(Citation: TrendMicro New Andariel Tactics July 2018)(Citation: CrowdStrike Silent Chollima Adversary September 2021) [Andariel](https://attack.mitre.org/groups/G0138) is considered a sub-set of [Lazarus Group](https://attack.mitre.org/groups/G0032), and has been attributed to North Korea's Reconnaissance General Bureau.(Citation: Treasury North Korean Cyber Groups September 2019) North Korean group definitions are known to have significant overlap, and some security researchers report all North Korean state-sponsored cyber activity under the name [Lazarus Group](https://attack.mitre.org/groups/G0032) instead of tracking clusters or subgroups.",2021-09-29T15:10:19.236Z,2024-09-12T18:36:06.078Z,intrusion-set--39d6890e-7f23-4474-b8ef-e7b0343c5fc8,https://attack.mitre.org/groups/G0138
G0125,HAFNIUM,HAFNIUM | Operation Exchange Marauder | Silk Typhoon,"[HAFNIUM](https://attack.mitre.org/groups/G0125) is a likely state-sponsored cyber espionage group operating out of China that has been active since at least January 2021. [HAFNIUM](https://attack.mitre.org/groups/G0125) primarily targets entities in the US across a number of industry sectors, including infectious disease researchers, law firms, higher education institutions, defense contractors, policy think tanks, and NGOs. [HAFNIUM](https://attack.mitre.org/groups/G0125) has targeted remote management tools and cloud software for intial access and has demonstrated an ability to quickly operationalize exploits for identified vulnerabilities in edge devices.(Citation: Microsoft HAFNIUM March 2020)(Citation: Volexity Exchange Marauder March 2021)(Citation: Microsoft Silk Typhoon MAR 2025)",2021-03-03T19:40:47.280Z,2025-03-25T18:04:13.368Z,intrusion-set--2688b13e-8e71-405a-9c40-0dee94bddf87,https://attack.mitre.org/groups/G0125
G0087,APT39,APT39 | ITG07 | Chafer | Remix Kitten,"[APT39](https://attack.mitre.org/groups/G0087) is one of several names for cyber espionage activity conducted by the Iranian Ministry of Intelligence and Security (MOIS) through the front company Rana Intelligence Computing since at least 2014. [APT39](https://attack.mitre.org/groups/G0087) has primarily targeted the travel, hospitality, academic, and telecommunications industries in Iran and across Asia, Africa, Europe, and North America to track individuals and entities considered to be a threat by the MOIS.(Citation: FireEye APT39 Jan 2019)(Citation: Symantec Chafer Dec 2015)(Citation: FBI FLASH APT39 September 2020)(Citation: Dept. of Treasury Iran Sanctions September 2020)(Citation: DOJ Iran Indictments September 2020)",2019-02-19T16:01:38.585Z,2024-04-11T02:59:52.392Z,intrusion-set--44e43fad-ffcb-4210-abcf-eaaed9735f80,https://attack.mitre.org/groups/G0087
G0069,MuddyWater,MuddyWater | Earth Vetala | MERCURY | Static Kitten | Seedworm | TEMP.Zagros | Mango Sandstorm | TA450,"[MuddyWater](https://attack.mitre.org/groups/G0069) is a cyber espionage group assessed to be a subordinate element within Iran's Ministry of Intelligence and Security (MOIS).(Citation: CYBERCOM Iranian Intel Cyber January 2022) Since at least 2017, [MuddyWater](https://attack.mitre.org/groups/G0069) has targeted a range of government and private organizations across sectors, including telecommunications, local government, defense, and oil and natural gas organizations, in the Middle East, Asia, Africa, Europe, and North America.(Citation: Unit 42 MuddyWater Nov 2017)(Citation: Symantec MuddyWater Dec 2018)(Citation: ClearSky MuddyWater Nov 2018)(Citation: ClearSky MuddyWater June 2019)(Citation: Reaqta MuddyWater November 2017)(Citation: DHS CISA AA22-055A MuddyWater February 2022)(Citation: Talos MuddyWater Jan 2022)",2018-04-18T17:59:24.739Z,2025-10-22T19:08:44.552Z,intrusion-set--269e8108-68c6-4f99-b911-14b2e765dec2,https://attack.mitre.org/groups/G0069
G0082,APT38,APT38 | NICKEL GLADSTONE | BeagleBoyz | Bluenoroff | Stardust Chollima | Sapphire Sleet | COPERNICIUM,"[APT38](https://attack.mitre.org/groups/G0082) is a North Korean state-sponsored threat group that specializes in financial cyber operations; it has been attributed to the Reconnaissance General Bureau.(Citation: CISA AA20-239A BeagleBoyz August 2020) Active since at least 2014, [APT38](https://attack.mitre.org/groups/G0082) has targeted banks, financial institutions, casinos, cryptocurrency exchanges, SWIFT system endpoints, and ATMs in at least 38 countries worldwide. Significant operations include the 2016 Bank of Bangladesh heist, during which [APT38](https://attack.mitre.org/groups/G0082) stole $81 million, as well as attacks against Bancomext (Citation: FireEye APT38 Oct 2018) and Banco de Chile (Citation: FireEye APT38 Oct 2018); some of their attacks have been destructive.(Citation: CISA AA20-239A BeagleBoyz August 2020)(Citation: FireEye APT38 Oct 2018)(Citation: DOJ North Korea Indictment Feb 2021)(Citation: Kaspersky Lazarus Under The Hood Blog 2017) North Korean group definitions are known to have significant overlap, and some security researchers report all North Korean state-sponsored cyber activity under the name [Lazarus Group](https://attack.mitre.org/groups/G0032) instead of tracking clusters or subgroups.",2019-01-29T21:27:24.793Z,2025-01-22T21:54:11.727Z,intrusion-set--00f67a77-86a4-4adf-be26-1a54fc713340,https://attack.mitre.org/groups/G0082
G0134,Transparent Tribe,Transparent Tribe | COPPER FIELDSTONE | APT36 | Mythic Leopard | ProjectM,"[Transparent Tribe](https://attack.mitre.org/groups/G0134) is a suspected Pakistan-based threat group that has been active since at least 2013, primarily targeting diplomatic, defense, and research organizations in India and Afghanistan.(Citation: Proofpoint Operation Transparent Tribe March 2016)(Citation: Kaspersky Transparent Tribe August 2020)(Citation: Talos Transparent Tribe May 2021)",2021-09-02T15:14:33.738Z,2024-04-10T22:30:51.062Z,intrusion-set--e44e0985-bc65-4a8f-b578-211c858128e3,https://attack.mitre.org/groups/G0134
