attack_id,name,aliases,description,created,modified,stix_id,url
G0050,APT32,APT32 | SeaLotus | OceanLotus | APT-C-00 | Canvas Cyclone | BISMUTH,"[APT32](https://attack.mitre.org/groups/G0050) is a suspected Vietnam-based threat group that has been active since at least 2014. The group has targeted multiple private sector industries as well as foreign governments, dissidents, and journalists with a strong focus on Southeast Asian countries like Vietnam, the Philippines, Laos, and Cambodia. They have extensively used strategic web compromises to compromise victims.(Citation: FireEye APT32 May 2017)(Citation: Volexity OceanLotus Nov 2017)(Citation: ESET OceanLotus)",2017-12-14T16:46:06.044Z,2024-04-17T22:07:49.430Z,intrusion-set--247cb30b-955f-42eb-97a5-a89fef69341e,https://attack.mitre.org/groups/G0050
G0060,BRONZE BUTLER,BRONZE BUTLER | REDBALDKNIGHT | Tick,"[BRONZE BUTLER](https://attack.mitre.org/groups/G0060) is a cyber espionage group with likely Chinese origins that has been active since at least 2008. The group primarily targets Japanese organizations, particularly those in government, biotechnology, electronics manufacturing, and industrial chemistry.(Citation: Trend Micro Daserf Nov 2017)(Citation: Secureworks BRONZE BUTLER Oct 2017)(Citation: Trend Micro Tick November 2019)",2018-01-16T16:13:52.465Z,2025-04-25T14:48:57.719Z,intrusion-set--93f52415-0fe4-4d3d-896c-fc9b8e88ab90,https://attack.mitre.org/groups/G0060
G1005,POLONIUM,POLONIUM | Plaid Rain,"[POLONIUM](https://attack.mitre.org/groups/G1005) is a Lebanon-based group that has primarily targeted Israeli organizations, including critical manufacturing, information technology, and defense industry companies, since at least February 2022. Security researchers assess [POLONIUM](https://attack.mitre.org/groups/G1005) has coordinated their operations with multiple actors affiliated with Iran’s Ministry of Intelligence and Security (MOIS), based on victim overlap as well as common techniques and tooling.(Citation: Microsoft POLONIUM June 2022)",2022-07-01T19:07:04.253Z,2024-01-08T21:56:22.594Z,intrusion-set--5f3d0238-d058-44a9-8812-3dd1b6741a8c,https://attack.mitre.org/groups/G1005
G1023,APT5,APT5 | Mulberry Typhoon | MANGANESE | BRONZE FLEETWOOD | Keyhole Panda | UNC2630,"[APT5](https://attack.mitre.org/groups/G1023) is a China-based espionage actor that has been active since at least 2007 primarily targeting the telecommunications, aerospace, and defense industries throughout the U.S., Europe, and Asia. [APT5](https://attack.mitre.org/groups/G1023) has displayed advanced tradecraft and significant interest in compromising networking devices and their underlying software including through the use of zero-day exploits.(Citation: NSA APT5 Citrix Threat Hunting December 2022)(Citation: Microsoft East Asia Threats September 2023)(Citation: Mandiant Pulse Secure Zero-Day April 2021)(Citation: Mandiant Pulse Secure Update May 2021)(Citation: FireEye Southeast Asia Threat Landscape March 2015)(Citation: Mandiant Advanced Persistent Threats)",2024-02-05T19:27:35.655Z,2025-04-04T17:08:23.100Z,intrusion-set--c1aab4c9-4c34-4f4f-8541-d529e46a07f9,https://attack.mitre.org/groups/G1023
G0135,BackdoorDiplomacy,BackdoorDiplomacy,"[BackdoorDiplomacy](https://attack.mitre.org/groups/G0135) is a cyber espionage threat group that has been active since at least 2017. [BackdoorDiplomacy](https://attack.mitre.org/groups/G0135) has targeted Ministries of Foreign Affairs and telecommunication companies in Africa, Europe, the Middle East, and Asia.(Citation: ESET BackdoorDiplomacy Jun 2021)",2021-09-21T14:52:49.596Z,2025-04-25T14:48:58.613Z,intrusion-set--9735c036-8ebe-47e9-9c77-b0ae656dab93,https://attack.mitre.org/groups/G0135
G0094,Kimsuky,Kimsuky | Black Banshee | Velvet Chollima | Emerald Sleet | THALLIUM | APT43 | TA427 | Springtail,"[Kimsuky](https://attack.mitre.org/groups/G0094) is a North Korea-based cyber espionage group that has been active since at least 2012. The group initially targeted South Korean government agencies, think tanks, and subject-matter experts in various fields. Its operations expanded to include the United Nations and organizations in the government, education, business services, and manufacturing sectors across the United States, Japan, Russia, and Europe. [Kimsuky](https://attack.mitre.org/groups/G0094) has focused collection on foreign policy and national security issues tied to the Korean Peninsula, nuclear policy, and sanctions. Its operations have overlapped with other DPRK actors, likely due to ad hoc collaboration or limited resource sharing.(Citation: EST Kimsuky April 2019)(Citation: Cybereason Kimsuky November 2020)(Citation: Malwarebytes Kimsuky June 2021)(Citation: CISA AA20-301A Kimsuky)(Citation: Mandiant APT43 March 2024)(Citation: Proofpoint TA427 April 2024) Because of overlapping operations, some researchers group a wide range of North Korean state-sponsored cyber activity under the broader [Lazarus Group](https://attack.mitre.org/groups/G0032) umbrella rather than tracking separate subgroup or cluster distinctions. [Kimsuky](https://attack.mitre.org/groups/G0094) was assessed to be responsible for the 2014 Korea Hydro & Nuclear Power Co. compromise; other notable campaigns include Operation STOLEN PENCIL (2018), Operation Kabar Cobra (2019), and Operation Smoke Screen (2019).(Citation: Netscout Stolen Pencil Dec 2018)(Citation: EST Kimsuky SmokeScreen April 2019)(Citation: AhnLab Kimsuky Kabar Cobra Feb 2019) In 2023, [Kimsuky](https://attack.mitre.org/groups/G0094) was observed using commercial large language models to assist with vulnerability research, scripting, social engineering and reconnaissance.(Citation: MSFT-AI)",2019-08-26T15:03:02.577Z,2025-11-12T18:55:12.319Z,intrusion-set--0ec2f388-bf0f-4b5c-97b1-fc736d26c25f,https://attack.mitre.org/groups/G0094
G0065,Leviathan,Leviathan | MUDCARP | Kryptonite Panda | Gadolinium | BRONZE MOHAWK | TEMP.Jumper | APT40 | TEMP.Periscope | Gingham Typhoon,"[Leviathan](https://attack.mitre.org/groups/G0065) is a Chinese state-sponsored cyber espionage group that has been attributed to the Ministry of State Security's (MSS) Hainan State Security Department and an affiliated front company.(Citation: CISA AA21-200A APT40 July 2021) Active since at least 2009, [Leviathan](https://attack.mitre.org/groups/G0065) has targeted the following sectors: academia, aerospace/aviation, biomedical, defense industrial base, government, healthcare, manufacturing, maritime, and transportation across the US, Canada, Australia, Europe, the Middle East, and Southeast Asia.(Citation: CISA AA21-200A APT40 July 2021)(Citation: Proofpoint Leviathan Oct 2017)(Citation: FireEye Periscope March 2018)(Citation: CISA Leviathan 2024)",2018-04-18T17:59:24.739Z,2025-02-03T21:55:54.314Z,intrusion-set--7113eaa5-ba79-4fb3-b68a-398ee9cd698e,https://attack.mitre.org/groups/G0065
G1046,Storm-1811,Storm-1811,"[Storm-1811](https://attack.mitre.org/groups/G1046) is a financially-motivated entity linked to [Black Basta](https://attack.mitre.org/software/S1070) ransomware deployment. [Storm-1811](https://attack.mitre.org/groups/G1046) is notable for unique phishing and social engineering mechanisms for initial access, such as overloading victim email inboxes with non-malicious spam to prompt a fake ""help desk"" interaction leading to the deployment of adversary tools and capabilities.(Citation: Microsoft Storm-1811 2024)(Citation: rapid7-email-bombing)(Citation: RedCanary Storm-1811 2024)(Citation: RedCanary June Insights 2024)",2025-03-14T12:48:44.771Z,2025-03-14T19:17:33.785Z,intrusion-set--319fd652-edde-46b2-9987-3519493989f5,https://attack.mitre.org/groups/G1046
G0130,Ajax Security Team,Ajax Security Team | Operation Woolen-Goldfish | AjaxTM | Rocket Kitten | Flying Kitten | Operation Saffron Rose,[Ajax Security Team](https://attack.mitre.org/groups/G0130) is a group that has been active since at least 2010 and believed to be operating out of Iran. By 2014 [Ajax Security Team](https://attack.mitre.org/groups/G0130) transitioned from website defacement operations to malware-based cyber espionage campaigns targeting the US defense industrial base and Iranian users of anti-censorship technologies.(Citation: FireEye Operation Saffron Rose 2013),2021-04-14T13:17:43.941Z,2023-10-09T16:46:55.719Z,intrusion-set--fa19de15-6169-428d-9cd6-3ca3d56075b7,https://attack.mitre.org/groups/G0130
G1024,Akira,Akira | GOLD SAHARA | PUNK SPIDER | Howling Scorpius,"[Akira](https://attack.mitre.org/groups/G1024) is a ransomware variant and ransomware deployment entity active since at least March 2023.(Citation: Arctic Wolf Akira 2023) [Akira](https://attack.mitre.org/groups/G1024) uses compromised credentials to access single-factor external access mechanisms such as VPNs for initial access, then various publicly-available tools and techniques for lateral movement.(Citation: Arctic Wolf Akira 2023)(Citation: Secureworks GOLD SAHARA) [Akira](https://attack.mitre.org/groups/G1024) operations are associated with ""double extortion"" ransomware activity, where data is exfiltrated from victim environments prior to encryption, with threats to publish files if a ransom is not paid. Technical analysis of [Akira](https://attack.mitre.org/software/S1129) ransomware indicates variants capable of targeting Windows or VMWare ESXi hypervisors and multiple overlaps with [Conti](https://attack.mitre.org/software/S0575) ransomware.(Citation: BushidoToken Akira 2023)(Citation: CISA Akira Ransomware APR 2024)(Citation: Cisco Akira Ransomware OCT 2024)",2024-02-20T23:59:25.966Z,2025-03-11T15:36:38.244Z,intrusion-set--46bb06cb-f2d9-4b37-8c92-a27e224ad90d,https://attack.mitre.org/groups/G1024
G0129,Mustang Panda,Mustang Panda | TA416 | RedDelta | BRONZE PRESIDENT | STATELY TAURUS | FIREANT | CAMARO DRAGON | EARTH PRETA | HIVE0154 | TWILL TYPHOON | TANTALUM | LUMINOUS MOTH | UNC6384 | TEMP.Hex | Red Lich,"[Mustang Panda](https://attack.mitre.org/groups/G0129) is a China-based cyber espionage threat actor that has been conducting operations since at least 2012. [Mustang Panda](https://attack.mitre.org/groups/G0129) has been known to use tailored phishing lures and decoy documents to deliver malicious payloads. [Mustang Panda](https://attack.mitre.org/groups/G0129) has targeted government, diplomatic, and non-governmental organizations, including think tanks, religious institutions, and research entities, across the United States, Europe, and Asia, with notable activity in Russia, Mongolia, Myanmar, Pakistan, and Vietnam. (Citation: BlackBerry MUSTANG PANDA October 2022)(Citation: Eset PlugX Korplug Mustang Panda March 2022)(Citation: Anomali MUSTANG PANDA October 2019)(Citation: Cisco Talos MUSTANG PANDA PLUGX PUBLOAD MAY 2022)(Citation: Secureworks BRONZE PRESIDENT December 2019)(Citation: DOJ Affidavit Search and Seizure PlugX December 2024)(Citation: EclecticIQ Mustang Panda PlugX)(Citation: ATTACKIQ MUSTANG PANDA TONESHELL March 2023)(Citation: Crowdstrike MUSTANG PANDA June 2018)(Citation: Palo Alto Networks, Unit 42)(Citation: Sophos PlugX September 2022)(Citation: Sophos Mustang Panda PLUGX)(Citation: Zscaler)",2021-04-12T15:56:28.861Z,2025-11-04T19:40:42.270Z,intrusion-set--420ac20b-f2b9-42b8-aa1a-6d4b72895ca4,https://attack.mitre.org/groups/G0129
G1004,LAPSUS$,LAPSUS$ | DEV-0537 | Strawberry Tempest,"[LAPSUS$](https://attack.mitre.org/groups/G1004) is cyber criminal threat group that has been active since at least mid-2021. [LAPSUS$](https://attack.mitre.org/groups/G1004) specializes in large-scale social engineering and extortion operations, including destructive attacks without the use of ransomware. The group has targeted organizations globally, including in the government, manufacturing, higher education, energy, healthcare, technology, telecommunications, and media sectors.(Citation: BBC LAPSUS Apr 2022)(Citation: MSTIC DEV-0537 Mar 2022)(Citation: UNIT 42 LAPSUS Mar 2022)",2022-06-09T19:14:31.327Z,2025-04-21T19:40:47.538Z,intrusion-set--d8bc9788-4f7d-41a9-9e9d-ee1ea18a8cf7,https://attack.mitre.org/groups/G1004
G0114,Chimera,Chimera,[Chimera](https://attack.mitre.org/groups/G0114) is a suspected China-based threat group that has been active since at least 2018 targeting the semiconductor industry in Taiwan as well as data from the airline industry.(Citation: Cycraft Chimera April 2020)(Citation: NCC Group Chimera January 2021),2020-08-24T17:01:55.842Z,2024-09-12T19:24:40.416Z,intrusion-set--8c1f0187-0826-4320-bddc-5f326cfcfe2c,https://attack.mitre.org/groups/G0114
G1018,TA2541,TA2541,"[TA2541](https://attack.mitre.org/groups/G1018) is a cybercriminal group that has been targeting the aviation, aerospace, transportation, manufacturing, and defense industries since at least 2017. [TA2541](https://attack.mitre.org/groups/G1018) campaigns are typically high volume and involve the use of commodity remote access tools obfuscated by crypters and themes related to aviation, transportation, and travel.(Citation: Proofpoint TA2541 February 2022)(Citation: Cisco Operation Layover September 2021)",2023-09-12T17:00:22.615Z,2024-04-10T22:38:45.199Z,intrusion-set--467271fd-47c0-4e90-a3f9-d84f5cf790d0,https://attack.mitre.org/groups/G1018
G1022,ToddyCat,ToddyCat,[ToddyCat](https://attack.mitre.org/groups/G1022) is a sophisticated threat group that has been active since at least 2020 using custom loaders and malware in multi-stage infection chains against government and military targets across Europe and Asia.(Citation: Kaspersky ToddyCat June 2022)(Citation: Kaspersky ToddyCat Check Logs October 2023),2024-01-03T21:34:10.988Z,2024-02-14T20:35:53.080Z,intrusion-set--b516b235-fc7d-4635-aca5-3d33312339c3,https://attack.mitre.org/groups/G1022
G1002,BITTER,BITTER | T-APT-17,"[BITTER](https://attack.mitre.org/groups/G1002) is a suspected South Asian cyber espionage threat group that has been active since at least 2013. [BITTER](https://attack.mitre.org/groups/G1002) has targeted government, energy, and engineering organizations in Pakistan, China, Bangladesh, and Saudi Arabia.(Citation: Cisco Talos Bitter Bangladesh May 2022)(Citation: Forcepoint BITTER Pakistan Oct 2016)",2022-06-01T20:26:53.880Z,2024-04-11T02:52:27.131Z,intrusion-set--7f848c02-4d1e-4808-a4ae-4670681370a9,https://attack.mitre.org/groups/G1002
G0048,RTM,RTM,[RTM](https://attack.mitre.org/groups/G0048) is a cybercriminal group that has been active since at least 2015 and is primarily interested in users of remote banking systems in Russia and neighboring countries. The group uses a Trojan by the same name ([RTM](https://attack.mitre.org/software/S0148)). (Citation: ESET RTM Feb 2017),2017-05-31T21:32:10.206Z,2025-04-25T14:49:01.288Z,intrusion-set--c416b28c-103b-4df1-909e-78089a7e0e5f,https://attack.mitre.org/groups/G0048
G0045,menuPass,menuPass | Cicada | POTASSIUM | Stone Panda | APT10 | Red Apollo | CVNX | HOGFISH | BRONZE RIVERSIDE,"[menuPass](https://attack.mitre.org/groups/G0045) is a threat group that has been active since at least 2006. Individual members of [menuPass](https://attack.mitre.org/groups/G0045) are known to have acted in association with the Chinese Ministry of State Security's (MSS) Tianjin State Security Bureau and worked for the Huaying Haitai Science and Technology Development Company.(Citation: DOJ APT10 Dec 2018)(Citation: District Court of NY APT10 Indictment December 2018) [menuPass](https://attack.mitre.org/groups/G0045) has targeted healthcare, defense, aerospace, finance, maritime, biotechnology, energy, and government sectors globally, with an emphasis on Japanese organizations. In 2016 and 2017, the group is known to have targeted managed IT service providers (MSPs), manufacturing and mining companies, and a university.(Citation: Palo Alto menuPass Feb 2017)(Citation: Crowdstrike CrowdCast Oct 2013)(Citation: FireEye Poison Ivy)(Citation: PWC Cloud Hopper April 2017)(Citation: FireEye APT10 April 2017)(Citation: DOJ APT10 Dec 2018)(Citation: District Court of NY APT10 Indictment December 2018)",2017-05-31T21:32:09.054Z,2024-11-17T23:19:12.450Z,intrusion-set--222fbd21-fc4f-4b7e-9f85-0e6e3a76c33f,https://attack.mitre.org/groups/G0045
G0116,Operation Wocao,Operation Wocao,"[Operation Wocao](https://attack.mitre.org/groups/G0116) described activities carried out by a China-based cyber espionage adversary. [Operation Wocao](https://attack.mitre.org/groups/G0116) targeted entities within the government, managed service providers, energy, health care, and technology sectors across several countries, including China, France, Germany, the United Kingdom, and the United States. [Operation Wocao](https://attack.mitre.org/groups/G0116) used similar TTPs and tools to APT20, suggesting a possible overlap.(Citation: FoxIT Wocao December 2019)",2020-11-17T20:33:44.273Z,2025-04-18T17:59:27.086Z,intrusion-set--28f04ed3-8e91-4805-b1f6-869020517871,https://attack.mitre.org/groups/G0116
G1053,Storm-0501,Storm-0501,"[Storm-0501](https://attack.mitre.org/groups/G1053) is a financially motivated cyber criminal group that uses commodity and open-source tools to conduct ransomware operations. [Storm-0501](https://attack.mitre.org/groups/G1053) has been active since 2021 and has previously been affiliated with Sabbath Ransomware and other Ransomware-as-a-Service (RaaS) variants such as Hive, [BlackCat](https://attack.mitre.org/software/S1068), Hunters International, [LockBit 3.0](https://attack.mitre.org/software/S1202), and [Embargo](https://attack.mitre.org/software/S1247) ransomware.(Citation: Avertium Storm-0501 Sabbath Ransomware Arcane January 2022)(Citation: Microsoft Storm-501 Sabbath Ransomware Embargo September 2024)(Citation: Microsoft Storm-0501 Embargo Ransomware August 2025)(Citation: Google Mandiant Storm-0501 Sabbath Ransomware November 2021)",2025-10-19T19:08:22.474Z,2025-10-24T02:33:31.401Z,intrusion-set--7b404cd0-3ae9-41d4-90c0-023793d35d97,https://attack.mitre.org/groups/G1053
G0081,Tropic Trooper,Tropic Trooper | Pirate Panda | KeyBoy,"[Tropic Trooper](https://attack.mitre.org/groups/G0081) is an unaffiliated threat group that has led targeted campaigns against targets in Taiwan, the Philippines, and Hong Kong. [Tropic Trooper](https://attack.mitre.org/groups/G0081) focuses on targeting government, healthcare, transportation, and high-tech industries and has been active since 2011.(Citation: TrendMicro Tropic Trooper Mar 2018)(Citation: Unit 42 Tropic Trooper Nov 2016)(Citation: TrendMicro Tropic Trooper May 2020)",2019-01-29T20:17:48.717Z,2025-10-21T23:19:38.101Z,intrusion-set--56319646-eb6e-41fc-ae53-aadfa7adb924,https://attack.mitre.org/groups/G0081
G1020,Mustard Tempest,Mustard Tempest | DEV-0206 | TA569 | GOLD PRELUDE | UNC1543,"[Mustard Tempest](https://attack.mitre.org/groups/G1020) is an initial access broker that has operated the [SocGholish](https://attack.mitre.org/software/S1124) distribution network since at least 2017. [Mustard Tempest](https://attack.mitre.org/groups/G1020) has partnered with [Indrik Spider](https://attack.mitre.org/groups/G0119) to provide access for the download of additional malware including LockBit, [WastedLocker](https://attack.mitre.org/software/S0612), and remote access tools.(Citation: Microsoft Ransomware as a Service)(Citation: Microsoft Threat Actor Naming July 2023)(Citation: Secureworks Gold Prelude Profile)(Citation: SocGholish-update)",2023-12-06T19:00:11.581Z,2024-03-25T21:23:15.556Z,intrusion-set--0d4ac089-ced4-4cc4-a989-174d08e6d030,https://attack.mitre.org/groups/G1020
G0073,APT19,APT19 | Codoso | C0d0so0 | Codoso Team | Sunshop Group,"[APT19](https://attack.mitre.org/groups/G0073) is a Chinese-based threat group that has targeted a variety of industries, including defense, finance, energy, pharmaceutical, telecommunications, high tech, education, manufacturing, and legal services. In 2017, a phishing campaign was used to target seven law and investment firms. (Citation: FireEye APT19) Some analysts track [APT19](https://attack.mitre.org/groups/G0073) and [Deep Panda](https://attack.mitre.org/groups/G0009) as the same group, but it is unclear from open source information if the groups are the same. (Citation: ICIT China's Espionage Jul 2016) (Citation: FireEye APT Groups) (Citation: Unit 42 C0d0so0 Jan 2016)",2018-10-17T00:14:20.652Z,2024-04-11T03:03:02.576Z,intrusion-set--fe8796a4-2a02-41a0-9d27-7aa1e995feb6,https://attack.mitre.org/groups/G0073
G1009,Moses Staff,Moses Staff | DEV-0500 | Marigold Sandstorm,"[Moses Staff](https://attack.mitre.org/groups/G1009) is a suspected Iranian threat group that has primarily targeted Israeli companies since at least September 2021. [Moses Staff](https://attack.mitre.org/groups/G1009) openly stated their motivation in attacking Israeli companies is to cause damage by leaking stolen sensitive data and encrypting the victim's networks without a ransom demand.(Citation: Checkpoint MosesStaff Nov 2021) Security researchers assess [Moses Staff](https://attack.mitre.org/groups/G1009) is politically motivated, and has targeted government, finance, travel, energy, manufacturing, and utility companies outside of Israel as well, including those in Italy, India, Germany, Chile, Turkey, the UAE, and the US.(Citation: Cybereason StrifeWater Feb 2022)",2022-08-11T22:47:27.686Z,2024-04-11T00:39:25.190Z,intrusion-set--4c4a7846-45d5-4761-8eea-725fa989914c,https://attack.mitre.org/groups/G1009
G0014,Night Dragon,Night Dragon,[Night Dragon](https://attack.mitre.org/groups/G0014) is a campaign name for activity involving a threat group that has conducted activity originating primarily in China. (Citation: McAfee Night Dragon),2017-05-31T21:31:51.643Z,2025-04-18T17:59:27.259Z,intrusion-set--23b6a0f5-fa95-46f9-a6f3-4549c5e45ec8,https://attack.mitre.org/groups/G0014
G0021,Molerats,Molerats | Operation Molerats | Gaza Cybergang,"[Molerats](https://attack.mitre.org/groups/G0021) is an Arabic-speaking, politically-motivated threat group that has been operating since 2012. The group's victims have primarily been in the Middle East, Europe, and the United States.(Citation: DustySky)(Citation: DustySky2)(Citation: Kaspersky MoleRATs April 2019)(Citation: Cybereason Molerats Dec 2020)",2017-05-31T21:31:55.093Z,2024-11-17T15:50:27.600Z,intrusion-set--df71bb3b-813c-45eb-a8bc-f2a419837411,https://attack.mitre.org/groups/G0021
G0038,Stealth Falcon,Stealth Falcon,"[Stealth Falcon](https://attack.mitre.org/groups/G0038) is a threat group that has conducted targeted spyware attacks against Emirati journalists, activists, and dissidents since at least 2012. Circumstantial evidence suggests there could be a link between this group and the United Arab Emirates (UAE) government, but that has not been confirmed. (Citation: Citizen Lab Stealth Falcon May 2016)",2017-05-31T21:32:06.390Z,2025-04-25T14:49:04.710Z,intrusion-set--894aab42-3371-47b1-8859-a4a074c804c8,https://attack.mitre.org/groups/G0038
G0105,DarkVishnya,DarkVishnya,[DarkVishnya](https://attack.mitre.org/groups/G0105) is a financially motivated threat actor targeting financial institutions in Eastern Europe. In 2017-2018 the group attacked at least 8 banks in this region.(Citation: Securelist DarkVishnya Dec 2018),2020-05-15T13:07:26.651Z,2025-04-25T14:49:05.248Z,intrusion-set--813636db-3939-4a45-bea9-6113e970c029,https://attack.mitre.org/groups/G0105
G0067,APT37,APT37 | InkySquid | ScarCruft | Reaper | Group123 | TEMP.Reaper | Ricochet Chollima,"[APT37](https://attack.mitre.org/groups/G0067) is a North Korean state-sponsored cyber espionage group that has been active since at least 2012. The group has targeted victims primarily in South Korea, but also in Japan, Vietnam, Russia, Nepal, China, India, Romania, Kuwait, and other parts of the Middle East. [APT37](https://attack.mitre.org/groups/G0067) has also been linked to the following campaigns between 2016-2018: Operation Daybreak, Operation Erebus, Golden Time, Evil New Year, Are you Happy?, FreeMilk, North Korean Human Rights, and Evil New Year 2018.(Citation: FireEye APT37 Feb 2018)(Citation: Securelist ScarCruft Jun 2016)(Citation: Talos Group123) North Korean group definitions are known to have significant overlap, and some security researchers report all North Korean state-sponsored cyber activity under the name [Lazarus Group](https://attack.mitre.org/groups/G0032) instead of tracking clusters or subgroups.",2018-04-18T17:59:24.739Z,2024-11-17T15:01:33.384Z,intrusion-set--4a2ce82e-1a74-468a-a6fb-bbead541383c,https://attack.mitre.org/groups/G0067
G0028,Threat Group-1314,Threat Group-1314 | TG-1314,[Threat Group-1314](https://attack.mitre.org/groups/G0028) is an unattributed threat group that has used compromised credentials to log into a victim's remote access infrastructure. (Citation: Dell TG-1314),2017-05-31T21:31:59.120Z,2025-04-25T14:49:05.962Z,intrusion-set--d519164e-f5fa-4b8c-a1fb-cf0172ad0983,https://attack.mitre.org/groups/G0028
G0096,APT41,APT41 | Wicked Panda | Brass Typhoon | BARIUM,"[APT41](https://attack.mitre.org/groups/G0096) is a threat group that researchers have assessed as Chinese state-sponsored espionage group that also conducts financially-motivated operations. Active since at least 2012, [APT41](https://attack.mitre.org/groups/G0096) has been observed targeting various industries, including but not limited to healthcare, telecom, technology, finance, education, retail and video game industries in 14 countries.(Citation: apt41_mandiant) Notable behaviors include using a wide range of malware and tools to complete mission objectives. [APT41](https://attack.mitre.org/groups/G0096) overlaps at least partially with public reporting on groups including BARIUM and [Winnti Group](https://attack.mitre.org/groups/G0044).(Citation: FireEye APT41 Aug 2019)(Citation: Group IB APT 41 June 2021)",2019-09-23T13:43:36.945Z,2025-06-11T20:13:29.024Z,intrusion-set--18854f55-ac7c-4634-bd9a-352dd07613b7,https://attack.mitre.org/groups/G0096
